species,text,url
Amphipyra pyramidoides,"Amphipyra pyramidoides, the copper underwing, is a species of moth in the family Noctuidae. It is found in the US and southern Canada. The wingspan is 38–52 mm. Adults are on wing from July through October depending on the location. There is one generation per year. They overwinter as eggs. The caterpillars are green with a white middorsal spiracular line, yellow spotting, and a hump at their eighth abdominal segment. Adult copper underwings have dappled brown forewings, and white hindwings with a black cross line and coppery orange suffusion. The larvae feed on the leaves of many broadleaf trees and shrubs, including apple, basswood, hawthorn, maple, oak, walnut, raspberry, grape, greenbrier (Smilax). The larvae are active in the spring; when ready to pupate they build a shelter by rolling a leaf. Aggregations of newly eclosed adults are found under bark, etc., in mid-summer. == References ==",https://en.wikipedia.org/wiki/Amphipyra_pyramidoides
Arctia caja,"The garden tiger moth has a wingspan of 45 to 65 millimeters (1.8 to 2.6 in). The design of the wings vary; the front wings are brown with a white pattern (which is sometimes missing), the back wings are orange with a pattern of black dots. There are many aberrations (pattern and colour variants), partly obtained artificially and partly by chance. Oberthür, a French entomologist, mentions about 500 different variants shown in 36 figures. Seitz gives an account of some named aberrations.",https://en.wikipedia.org/wiki/Garden_tiger_moth
Haematopis grataria,"Adults of this species rest with their wings held out flat and to their sides. Their wings are a pale yellow, and their forewings each have a small red or pink spot in the center. Both the forewings and the hindwings each have two pink or red bands, which appear to be continuous across both sets of wings when the moth is in its resting position. Male chickweed geometers have feathered antennae, while females have thinner, thread-like antennae.",https://en.wikipedia.org/wiki/Haematopis
Callophrys rubi,"Callophrys rubi has a wingspan reaching about 26–30 millimetres (1.0–1.2 in) in length. The oversides of the wings are a uniform dull brown, with two paler patches on the male's forewings made up of scent scales. The undersides are a bright green with a thin white line, often reduced to a faint row of dots or even missing altogether. The iridescent green colour of the undersides is a structural colour caused by diffraction and interference of light by microscopic repeating structures forming a diffraction grating in the wing scales. The caterpillars are green with yellow markings along the back. Like other members of the family they are rather sluglike.",https://en.wikipedia.org/wiki/Green_hairstreak
Hyalophora cecropia,"Hyalophora cecropia, the cecropia moth, is North America's largest native moth. It is a member of the family Saturniidae, or giant silk moths. Females have been documented with a wingspan of five to seven inches (13 to 18 cm) or more. These moths can be found predominantly across eastern North America, with occurrences as far west as Washington and north into the majority of Canadian provinces. Cecropia moth larvae are most commonly found on maple trees, but they have also been found on cherry and birch trees, among many others. The species was first described by Carl Linnaeus in his 1758 10th edition of Systema Naturae.",https://en.wikipedia.org/wiki/Hyalophora_cecropia
Phalera bucephala,"The moth is a fairly large, heavy-bodied species with a wingspan of 55–68 mm (2.2–2.7 in). The forewings are grey with a large prominent buff patch at the apex. As the thoracic hair is also buff, the moth resembles a broken twig when at rest. The hindwings are creamy white. Seitz - Head, collar and centre of thorax brownish yellow, patagia greyish white with a black-brown double basal edge, on the transverse crest 2 black-brown transverse lines, hind margin greyish white. Abdomen yellowish grey to yellowish brown. Forewing greyish brown, broadly white at the base and along the hind margin, with prediscal dark brown and black double band; at the apex a large oval yellow patch reaching down to vein 4, proximally bordered by a dark red-brown semicircle, and traversed below the apex by a broad dentate dull ochreous submarginal spot; the black postdiscal band semicircular in the costal half, parallel with the dark border of the apical patch, and then dentate, accompanied on the outer side by a dark brown line; discal spot whitish; the scaling with a strong silky gloss, excepting the apical patch. Hindwing whitish grey, with a very slight indication of a dark median band. On the underside both wings have a prominent black-brown discal band, forewing moreover with a black-browia marginal line. Throughout Europe with the exception of the Arctic Region and Greece; also in North-East Africa, Asia Minor, Siberia to East Asia. In Central Europe abundant everywhere in May and June, a second brood in July and August appears regularly only in the South. — In Norway and Southern Sweden, also in England occurs a dark form, tenebrata Strand, [subspecies P. b. tenebrata Strand, 1903] in which the white colouring of the forewing is more or less strongly reduced, particularly in the median area, while the hindwing is paler or darker grey. In ab. demaculata Strand (47 d) [aberration] the pale discal spot of the forewing moreover is absent. — bucephalina Stgr.,[ now species Phalera bucephalina (Staudinger & Rebel, 1901)] which represents the species in Western Morocco, is also characterised by a darker colouring of the ground. In addition, the discal spot is more prominent and the apical patch larger, in which characters this form approaches the next species, bucephaloides. — In the East-Asiatic infulgens Graes. (47 d)[now subspecies P. b. infulgens Graeser, 1888], which is common in the Amur and Ussuri districts, the whole forewing is uniformly whitish grey without gloss, the anterior half being hardly darker than the hind margin; the hindwing is somewhat narrower. — Egg strongly, convex green with darker top and paler base. Larva orange yellow, with glossy black head and yellowish grey hair, as well as black longitudinal stripes interrupted bet- ween the segments, 5 stripes dorsally and 2 laterally, between the latter pair the black spiracles are placed.Underside black with broad yellow median stripe, abdominal legs black outside and yellow inside. June to October, on Salix, Poplar, Birch, Lime and Oak. Pupa glossy black-brown, sometimes hibernating twice. The moth flies at night in June and July and sometimes comes to light, although it is not generally strongly attracted. The young larvae are gregarious, becoming solitary later. The older larva is very striking, black with white and yellow lines. It feeds on many trees and shrubs (see list below). The species overwinters as a pupa.",https://en.wikipedia.org/wiki/Buff-tip
Junonia iphita,"Upperside of both sexes brown, of varying depths of colour. Forewing: cell with one pair of subbasal and one pair of apical transverse sinuous fasciae, the outermost defining the discocellulars; a short, broad, dark, oblique fascia beyond to vein 4, its inner margin diffuse, its outer sinuous but sharply defined; below vein 4 a sinuous, transverse, fainter fascia, followed by a discal blackish fascia, very broad and diffuse below costa, bordered by a row of faint ocelli, and a postdiscal and a subterminal similar fascia following the outline of the termen. Hindwing with a slender blackish loop near apex of cellular area; a broad inwardly diffuse, outwardly well-defined short discal fascia in continuation of the one on the forewing; a series of postdiscal somewhat ochraceous ocelli with black pupils minutely centred with white; postdiscal and subterminal broad lines as on the forewing. Underside brown, with very broad darker brown transverse fasciae; the interspaces between the markings irrorated (sprinkled) with purplish silvery scales. Forewing with two sinuous fasciae on the basal half, succeeded by a discal fascia, very broad at the costal margin and decreasing in width to the dorsum, bearing on its outer border a row of obscure ocelli. This is succeeded by a zigzag dark line, and sinuous subterminal and terminal lines; apex and tornal area suffused with purplish silvery. Hindwing: two irregular, very broad, dark brown, curved short fasciae near base; a straight, transverse, prominent, narrow ochreous-brown discal band defined outwardly by a black line; a transverse postdiscal dark brown fascia, widest in the middle and bearing outwardly a curved row of ochreous-brown white-centred ocelli, followed by a zigzag dark line in continuation of the one on the forewing; a subterminal somewhat diffuse dark fascia and a terminal dark line. Antennae, head, thorax, and abdomen dark brown.",https://en.wikipedia.org/wiki/Junonia_iphita
Operophtera brumata,"The forewing ground colour of the winged males varies from grey-yellow to beige-brown or occasionally slightly reddish-tinted. The patterns are often band-shaped dark brownish, often indistinct. The fringe is yellowish. The hindwings are pale grey or yellow grey. The antennae are short and finely hairy. The female appears completely wingless, but in fact female winter moths have greatly reduced wings. The flightless female has a brownish-grey body with rudimentary wing stubs that are brown to grey and have dark bands. Body length for both sexes is approximately 1 cm (0.4 in). Larvae are 0.1 inches (2.5 mm) in length after hatching and will grow to 0.75 inches (19 mm) over a six-week period. In North America, the winter moth can be confused with the related native species, the Bruce spanworm (Operophtera bruceata). In fact, the two species hybridize.",https://en.wikipedia.org/wiki/Winter_moth
Nymphalis californica,The wings of the California tortoiseshell have ragged edges. The upper sides of the wings are orange with black spots and a wide black margin. The undersides of the wings are a mottled dark brown. Its wingspan varies from 3.2 to 7 cm (1+1⁄4–2+3⁄4 inches). Caterpillars are black with white spots and hairs. Each segment of the body has seven spines.,https://en.wikipedia.org/wiki/California_tortoiseshell
Alypia octomaculata,"Full grown larvae reach up to 25.4–38 millimetres (1–1+1⁄2 in). The moth is overall black with two spots on each wing (total of eight spots), it's forewing ranges between shades of white, cream, or yellow. Their wingspan is around 30–37 millimetres (1.2–1.5 in). These moths are active during the day and night, often being mistaken as a butterfly.",https://en.wikipedia.org/wiki/Alypia_octomaculata
Palthis asopialis,"Palthis asopialis, the faint-spotted palthis moth, is a moth of the family Erebidae. The species was first described by Achille Guenée in 1854. It is found in North America, from Florida north to Ontario and west to Texas. The wingspan is 19–23 mm. The moth flies from January to October depending on the location. There are at least two generations in the north-east. There are more generations in the south. Recorded food plants include Bidens species, and the leaves of beans, corn, and oak.",https://en.wikipedia.org/wiki/Palthis_asopialis
Erynnis baptisiae,"Erynnis baptisiae, the wild indigo duskywing, is a species of butterfly of the family Hesperiidae. It is found in North America from southern Ontario and New England, west to central Nebraska, and south to Georgia, the Gulf Coast, and south-central Texas. Host plants include wild indigo, wild blue indigo, lupine, false lupine, and crown vetch.",https://en.wikipedia.org/wiki/Erynnis_baptisiae
Amata phegea,"Amata phegea reaches a wingspan of 35–40 millimetres (1.4–1.6 in). Males are smaller than females and have thicker antennae. Wings are blueish black or greenish black with white spots and metallic sheen. The number and the size of spots are quite variable. Usually there are six white spots on the forewings and two or three spots on the hindwings. The body is quite long, with a yellow spot on the second segment of the abdomen. A further feature is the prominent yellow ring at the sixth segment of the abdomen. The black thread-like antennae have white tips. The caterpillars can reach a length of about 5 centimetres (2.0 in). They are gray black with thick dark brown, fluffy hairs that grow from small growths. The head is reddish brown. Similar-looking moths include Amata ragazzii (Turati, 1917) and Zygaena ephialtes (Linnaeus, 1758). Z. ephialtes is in the family Zygaenidae and is unpalatable to birds. The nine-spotted moth imitates its appearance (Müllerian mimicry). Both moths are an example of aposematism.",https://en.wikipedia.org/wiki/Nine-spotted_moth
Eusarca confusaria,"The wingspan of this species is between 29 and 41 mm. Adults are quite variable but tend to be yellow to tan with gray smudging, some specimens look exceptionally dark compared to lighter variants. Uncommonly individuals will have dark spotting in the subterminal area of the forewing. There are several species that are easily confused with E. confusaria including the dark-edged eusarca (Eusarca fundaria), juniper geometer (Patalene olyzonaria), curve-toothed geometer (Eutrapela clemataria), large maple spanworm (Prochoerodes lineola) and the rose hooktip (Oreta rosea).",https://en.wikipedia.org/wiki/Eusarca_confusaria
Icaricia acmon,"Icaricia acmon, the Acmon blue, is a North American butterfly. It ranges mainly in California and Oregon but can also be seen in southwestern Canada and in the Great Plains Region of the United States, with a total range of about 2,500,000 square km. Because of the breadth of its range, it occurs in several different habitats, such as grasslands, fields, shrub lands, forests, and deserts. Acmon blue was discovered by Pierre Lorquin in 1850, while he visited California during the Gold Rush. It is believed that Acmon Blue was discovered in the San Francisco area. Wingspan is between the range of 17-30 mm. The tops of the wings are blue with dark edges in males and brown in females. Its underside is white with black spots for both sexes and a red-orange band on the hindwing. Caterpillars are yellow with white hairs and a green stripe down the back. The Acmon is richly colored, more specifically the females with contrasting rows of red lunules (sometimes fused into a band). Meanwhile, the male's hindwing lunules tend to become pink and may disappear during autumn. Like many other lycaenid butterflies, it has a mutualistic relationship with ants, who protect Acmon blue larvae in exchange for honeydew that the larvae secrete.",https://en.wikipedia.org/wiki/Acmon_blue
Idaea seriata,"An extremely variable species, ranging from almost pure white forms without markings or with well expressed lines to unicolorous black-grey forms. The vertex of the head remains whitish in all the forms, the collar dark. The lines, when present, do not arise from enlarged costal spots, though not infrequently the costal extremity of the lines is a little blacker than the rest. The first line of the forewing is angled on the subcostal vein or at least strongly bent; it is thickened with dark marks on the veins. The median shade is thicker, not rarely rather strongly developed, often, on the contrary, quite obsolete even in forms in which the lines are sharply marked; it usually touches the cell-spot on the forewing and is always proximal to it on the hindwing. The postmedian is fine and grey, not itself conspicuous but marked with strong, coarse black spots on the veins; it stands rather near the distal margin and is incurved between the radials, then outcurved; the form of this line is best shown on the right forewing in our figure and may be compared to that which occurs in a higher degree of development in calunetaria. The pale subterminal line is slightly more strongly bent (or angled) inwards between the radials; it is often almost indistinguishable an account of the lack of dark shading accompanying it, but the dark shading may also be moderately or even very strong, sometimes almost filling the distal area and forming a dark border to the wings; this dark shading scarcely ever shows a tendency to break up into spots, herein differing markedly from incisaria [Idaea incisaria (Staudinger, 1892)], camparia [Idaea camparia (Herrich-Schäffer, 1852)], sodaliara [ Idaea sodaliaria Herrich-Schäffer, 1852 ], etc.; distal marginal line consisting of a series of black dashes of variable thickness, sometimes almost obsolete; fringe with more or less strong dark dots at base, opposite the vein-ends. Forewing beneath more or less suffused, often dark smoke-colour, the postmedian line and the cell-spot, however, usually well expressed; hindwing beneath white or whitish, marked (or unmarked) nearly according to the upper surface of the particular form. The typical seriata of Central and Northern Europe is more or less strongly dusted, thus appearing grey, but includes a wide range of subordinate variation, not only in the intensity of the dusting but also in the expression of the lines, the median shade or the dark bordering, either singly or in combination. Either one or two broods are produced each year and the species can be seen on the wing any time from June to September, flying at night and sometimes coming to light. The larva feeds on ivy and the species overwinters in this form. ^ The flight season refers to the British Isles. This may vary in other parts of the range.",https://en.wikipedia.org/wiki/Small_dusty_wave
Hamadryas februa,"Hamadryas februa, the gray (or grey) cracker, is a species of cracker butterfly in the family Nymphalidae. It is found from Argentina north through tropical America to Mexico. Rare strays can be found up to the lower Rio Grande Valley in southern Texas. The habitat consists of subtropical forests, forest edges and cultivated areas with trees. The wingspan is 70–86 mm. Adults are on wing year round in the tropics and from August to October in southern Texas. They feed on sap and rotting fruit. The larvae feed on Dalechampia and Tragia species.",https://en.wikipedia.org/wiki/Hamadryas_februa
Ceratomia undulosa,"Ceratomia undulosa, the waved sphinx, is a moth of the family Sphingidae. The species was first described by Francis Walker in 1856. Also known as the ""Scorpion Moth"" (See ""Biology"" Below"").",https://en.wikipedia.org/wiki/Ceratomia_undulosa
Pyrausta despicata,"The wingspan of Pyrausta despicata can reach 14–19 mm. The wings are brown or greyish, with quite variable pale brown markings. The forewings are brownish grey or brown, sometimes blackish-sprinkled; first line obscurely pale or obsolete; second in pale greyish-ochreous, often obsolete except on costa, in male whitish-ochreous, dilated on costa; small orbicular and oval discal spot rather darker, in female sometimes separated by a pale spot; sometimes a pale subterminal streak. Hindwings in male grey in female blackish; sometimes a darker discal dot; a curved postmedian fascia and subterminal streak in male obscurely ochreous-whitish, in female whitish-ochreous. The larva is dull brownish-black; dorsal line double, grey; spiracular dull ochreous; spots black, grey circled; head and plate of 2 brown, darker-freckled The moth flies from May to September depending on the location, in two generations. It is active in the sunshine and at dusk. The larvae feed on Plantago lanceolata and Plantago major.",https://en.wikipedia.org/wiki/Pyrausta_despicata
Patania ruralis,"The wingspan is 26–40 millimetres (1.0–1.6 in). The forewings are pale whitish-ochreous, yellowish-tinged; a grey subcostal suffusion and connected orbicular dot; lines rather dark grey, first straight, second serrate, curved, strongly broken inwards beneath middle; a dark grey discal mark, nearly followed by a grey blotch; a grey terminal band, edge parallel to second line. Hindwings with colour, discal mark, and posterior markings as in forewings. The caterpillar larva is whitish green, sides greener; dorsal line darker; head green. The larvae feed mainly on stinging nettle (Urtica dioica), as well as small nettle (U.urens). Less often they have been found on hops (Humulus lupulus), another member of the urticalean (nettle) clade of the Rosales. From the Caryophyllales, goosefoot (Chenopodium) and orache (Atriplex) have been recorded as occasional foodplants. They are notable for their rolling locomotion; the rolling behaviour of the caterpillar has been used as a model to create next-generation robots that roll.",https://en.wikipedia.org/wiki/Patania_ruralis
Lycaena tityrus,"C. dorilis Hufn. (= circe Schiff., garbas F., phocas Rott., dorylas Kirby) (77 c) Male above black- brown, with a magnificent metallic green gloss when alive, with black spots corresponding to those of the underside and with a very thin reddish lunate line before the margin of the hindwing. Female above similar to phlaeas, but paler yellow, and with a very thin black edge instead of a broad black marginal band. Beneath yellowish grey, with very numerous black ocelli and small russet-red spots before the margin. Throughout Europe, from the North Sea to the Mediterranean, with the exception of Great Britain; also in Asia Minor. — In the much larger subalpina Spr. (= xanthe F., montana M.-Durr) (77 d)[now subspecies] the underside is more plumbeous grey than yellowish grey, and the red submarginal spots are reduced; from the Alps. — On the other hand, the underside of orientalis Stgr. (77 d) is more yellowish and the upperside of the female entirely blackish; from Anterior Asia to the Altai. — bleusei Oberth. (77d) [now full species Lycaena bleusei ] is much brighter above, with stronger yellow variegation, and the hindwing has a short triangular tail; from Castilia. — Also in this species specimens with abnormally dark upperside have been found: males which are devoid of the red submarginal band to the hindwing above — ab. obscurior S. L. (= fusca Gillm.) — and whose females are dark like the males, also specimens with more extended light yellow area on the forewing — ab. albicans Fuchs (= nyeni Ter Haar) —, both forms being quite inconstant. Other occasionally observed pale forms are a yellow one (ab. fulvior Stef.) and a white one (ab. upoleuca Verity). In ab. strandi Schultz the submarginal dots of the underside are modified to stripes, ab. brunnea Wheel, is an aberration of subalpina in which the dark upperside is devoid of the coppery sheen found in fresh subalpina. The ab. caeruleopunctata of phlaeas is represented among dorilis by ab. brantsi Ter Haar (= purpureopunctata Wheel.), in which the hindwing above bears a row of whitish dots before the outer third, ab. nana Wheel, is only a dwarfed form. In ab. fulvomarginalis Schultz the narrow red-yellow band of the hindwing above is continued on to the forewing also in the male— Egg semiglobular, dull green, somewhat darker at the top, coarsely punctured. Larva light green, minutely dotted with whitish, on the back occasionally with violet sheen, some specimens bear minute red markings. It hibernates and feeds until April and again in the summer, on Rumex. Pupa greenish or brown, with dark dorsal line and lighter sides, with minute dark dots. The butterflies occur all through the summer, in the south in three overlapping broods, on roads among fields and on broad sunny forest-roads; they visit according to season particularly Potentilla, Ranunculus, Chrysanthemum, Thymus and Leontodon, and, though not confined to certain flight-places, occur sometimes in large numbers together. In the Alps subalpina ascends to a considerable height (Seiser Alp). In some localities dorilis flies together with alciphron so that Mackee considers certain intermediate specimens to be hybrids (ab. xanthoides). == References ==",https://en.wikipedia.org/wiki/Lycaena_tityrus
Euclidia glyphica,"The burnet companion moth (Euclidia glyphica) is a moth of the family Erebidae. It is found in most of the Palearctic realm, from Ireland in the west to Mongolia and Siberia in the east and south to the Mediterranean and North Africa.",https://en.wikipedia.org/wiki/Burnet_companion
Achyra rantalis,"Achyra rantalis, the garden webworm, is a moth of the family Crambidae described by Achille Guenée in 1854. It is found in North America, where it has been recorded from Maine to southern Quebec and Ontario, south to Florida and Mexico. It has also been recorded in Iowa, Colorado, California, and the West Indies. Its habitat consists of fields and gardens. The wingspan is 17–23 millimetres (0.67–0.91 in). There may be up to four generations per year in the south. The larvae feed on the leaves of various low-growing plants, including alfalfa, beans, clover, corn, cotton, peas and strawberries. == References ==",https://en.wikipedia.org/wiki/Achyra_rantalis
