species,text,url
Danaus plexippus,"Although monarch larvae eat only milkweed, adult monarchs and other pollinators feed on the nectar of many plants, including: Adult monarchs prefer to feed on sturdy plants that have relatively flat surfaces (sunflowers, asters) or long multi-flowering inflorescences (gayfeather), where the nectar is easily accessed, as in many species in the Asteraceae (sunflower) family. Common characteristics of this family include clusters of flowers with shallow, easily accessed nectar. Milkweeds, which also have easily accessible nectar, are excellent nectar sources. Publications have reported that Mexican sunflower (Tithonia rotundifolia) is especially attractive to adult monarchs. Like that species, coneflowers (Echinacea spp.), gayfeathers (Liatris spp.), goldenrods (Solidago spp.), blue mistflower (Conoclinium coelestinum), frostweed (Verbesina virginica), Joe-Pye weeds (Eutrochium spp.), ironweeds (Vernonia spp.), asters (Symphyotrichum spp. and Eurybia spp.) and other late-flowering genera of the Asteraceae family, are major nectar sources for monarchs during their fall migration. During the spring migration, important nectar sources include early-blooming Asclepias spp., Coreopsis spp., Viburnum spp., and Phlox spp. Monarchs obtain moisture and minerals from damp soil and wet gravel, a behavior known as mud-puddling. The monarch has also been noticed puddling at an oil stain on the pavement.",https://en.wikipedia.org/wiki/Monarch_butterfly
Vanessa atalanta,"The forewing of this butterfly bears on a black ground an oblique vermilion band and a group of white subapical spots. On the hindwing the larger portion of the distal margin is red, with a row of small black spots and at the anal angle an elongate blue spot. The underside is partly variegated with blue; the forewing is on the whole similar in markings to the upper, while the hindwing is brightly variegated and clouded, bearing black markings, of which those in the cell resemble a figure (on the left wing 18 or 98, on the right 81 or 89); in the middle of the costal area there is a pale patch and in the distal marginal area a row of ocellus-like spots. Sometimes, especially in the female, the red band of the forewing bears a small white spot in the middle.",https://en.wikipedia.org/wiki/Vanessa_atalanta
Pieris rapae,In appearance it looks like a smaller version of the large white (Pieris brassicae). The upperside is creamy white with black tips on the forewings. Females also have two black spots in the center of the forewings. Its underwings are yellowish with black speckles. It is sometimes mistaken for a moth due to its plain appearance. The wingspan of adults is roughly 32–47 mm (1.3–1.9 in). Pieris rapae has a wingbeat frequency averaging 12.8 flaps per second.,https://en.wikipedia.org/wiki/Pieris_rapae
Dione vanillae,"In its adult form, the gulf fritillary is a medium-sized butterfly that has extended forewings and a wingspan range of 6.5 to 9.5 cm. This butterfly exhibits sexual dimorphism as females are typically distinctively larger in size than males. The underside of the wings is brown and speckled with silvery white dots. In contrast, the top surface layer of the wings is deep orange in color with black streaks running across. In addition to the size difference between the two sexes, females are usually darker in color and are more marked with black streaks as compared to the males.",https://en.wikipedia.org/wiki/Gulf_fritillary
Vanessa cardui,"Male and female. Upperside. Ground-colour reddish-ochreous, basal areas olivescent-ochreous-brown; cilia black, alternated with white, Forewing with an outwardly-oblique black irregular-shaped broken band crossing from middle of the cell to the disc above the submedian vein; the apical area from end of cell and the exterior border also black; before the apex is a short white outwardly-oblique streak and a curved row of four round spots, the second and third being small; a marginal pale lunular line with its upper portion most defined and whitish. Hind-wing with a blackish patch from the costal vein across end of cell, a partly confluent recurved discal band, a submarginal row of lunules, and then a marginal row of somewhat scutiform spots; between the discal band and submarginal lunules is a row of five round black spots, which in some examples show a pale and dark outer ring. Underside. Forewing brighter reddish-ochreous, the apical area and outer margin much paler, the apex being olivescent ochreous-brown; discal irregular band as above, subapical white streak, row of spots and marginal lunules distinct; base of wing and interspace before end of cell white. Hindwing transversely-marbled with olivescent ochreous-brown and speckled with black scales; crossed by basal and discal sinuous whitish or pale fascia and intersected by white veins; an outer-discal row of five ocelli, the upper one smallest and usually imperfect, the second and fifth the largest, the fourth with black centre speckled with blue and ringed with yellow, and the second and fifth also with an outer black ring; submarginal lunules purpurescent-grey, bordered by a whitish fascia; outer margin ochreous. Body olivescent ochreous-brown, abdomen with ochreous bands; palpi blackish above, white beneath; body beneath and legs greyish-white; antennae black above, tip and beneath reddish.",https://en.wikipedia.org/wiki/Vanessa_cardui
Papilio glaucus,"The wingspan ranges from 7.9 to 14 cm (3.1 to 5.5 in) with females being the larger sex. Southern individuals are larger than northern ones. Males are yellow with four black ""tiger stripes"" on each forewing. The outer edge of the forewing is black with a row of yellow spots. The veins are marked with black. The postmedian area of the hindwing is black with yellow spots along the margin. The inner margin of the hindwing has small red and blue spots. The ventral forewing margin has a yellow bar that is broken into spots. This broken bar is present in both sexes, and is used to distinguish P. glaucus from its close relatives. Females are dimorphic. The yellow morph differs from the male in having a blue postmedian area on the dorsal hindwing. In the dark morph, the areas that are normally yellow are replaced with dark gray or black. The bluish postmedian area on the ventral hindwing has one row of orange spots. A shadow of the ""tiger stripes"" can be seen on the underside of some dark females. P. glaucus is one of a few species of papilionids known to produce gynandromorphs. Most bilateral gynandromorphs are hybrids of P. glaucus and P. canadensis that are found along hybrid zones. Color mosaics are found in the central part of the species range.",https://en.wikipedia.org/wiki/Papilio_glaucus
Papilio polyxenes,"Papilio polyxenes, the (eastern) black swallowtail, American swallowtail or parsnip swallowtail, is a butterfly found throughout much of North America. An extremely similar-appearing species, Papilio joanae, occurs in the Ozark Mountains region, but it appears to be closely related to Papilio machaon, rather than P. polyxenes. The species is named after the figure in Greek mythology, Polyxena (pron.: /pəˈlɪksɨnə/; Greek: Πολυξένη), who was the youngest daughter of King Priam of Troy. Its caterpillar is often called the ""parsleyworm"" because the caterpillar feeds on parsley. The Papilio polyxenes demonstrates polyandry and a lek mating system, showing no male parental care and display sites. Females are therefore able to choose males based on these sites and males are the only resource the females find at these sites.",https://en.wikipedia.org/wiki/Papilio_polyxenes
Pararge aegeria,"The average wingspan of both males and females is 5.1 cm (2 in), although males tend to be slightly smaller than females. Furthermore, males possess a row of grayish-brown scent scales on their forewings that is absent in the females. Females have brighter and more distinct markings than males. The subspecies P. a. tircis is brown with pale yellow or cream spots and darker upperwing eyespots. The subspecies P. a. aegeria has a more orange background and the hindwing underside eyespots are reddish brown rather than black or dark gray. The two forms gradually intergrade into each other. Subspecies P. a. oblita is a darker brown, often approaching black with white rather than cream spots. The underside of its hindwings has a marginal pale purple band and a row of conspicuous white spots. The spots of subspecies P. a. insula are a tawny orange rather than a cream color. The underside of the forewings has patches of pale orange, and the underside of the hindwing has a purple-tinged band. Although there is considerable variation with each subspecies, identification of the different subspecies is manageable. The morphology of this butterfly varies as a gradient down its geographic cline from north to south. The northern butterflies in this species have a bigger size, adult body mass, and wing area. These measurements decrease as one moves in a southerly direction in the speckled wood's range. Forewing length on the other hand increases moving in a northerly direction. This is due to the fact that in the cooler temperatures of the northern part of this butterfly's range, the butterflies need larger forewings for thermoregulation. Finally, the northern butterflies are darker than their southern counterpart, and there is a coloration gradient, down their geographical cline.",https://en.wikipedia.org/wiki/Speckled_wood_(butterfly)
Aglais io,"The butterfly has a wingspan of 50 to 55 millimetres (2 to 2+1⁄8 in). The base colour of the wings is a rusty red, and at each wingtip it bears a distinctive, black, blue and yellow eyespot. The underside is a cryptically coloured dark brown or black, mimicking a dead leaf. There are two subspecies: A. io caucasica (Jachontov, 1912), found in Azerbaijan, and A. io geisha (Stichel, 1908), found in Japan and the Russian Far East.",https://en.wikipedia.org/wiki/Aglais_io
Polyommatus icarus,"Polyommatus icarus has a wingspan of 28–36 millimetres (1.1–1.4 in). The dorsal side of the wings is an iridescent lilac blue, bright violet-blue, or almost hyacinth-blue with a thin black border. Females' wings are brown or black-brown with a row of red reddish yellow spots along the edges of the wings (marginal spots) and usually some blue at the base. The extent of blue and brown is extremely variable depending on location. The top of the wings in the female may be mostly blue, especially in Ireland and Scotland, but it always has red spots. The ventral side has a greyish or dust-grey base colour in the males and a more brownish hue in the females. Both sexes have a row of red or orange spots along the edge of the hindwing and extending onto the forewing, though they are generally fainter there, particularly in the males, where they are sometimes missing altogether. There are about a dozen black-centered white spots (ocelli) on the hindwing and nine on the forewing. These usually include one in the middle of the forewing cell, absent in Chapman's and Escher's blues. The fringes on the outer edge of the wings are uniform white, not crossed with black lines as in the chalkhill and Adonis blues (that is, the common blue lacks checkering). Other similar species are:- Polyommatus semiargus Polyommatus coridon Polyommatus dorylas Polyommatus amandus Polyommatus damon Polyommatus celina The caterpillar is small, pale green with yellow stripes and, as usual with Lycaenid larvae, rather slug-like.",https://en.wikipedia.org/wiki/Common_blue
Hylephila phyleus,"The fiery skipper (Hylephila phyleus) is a species of butterfly in the family Hesperiidae. Reaching approximately 1 inch (2.5 cm) in length, male fiery skippers are orange or yellow while the females are dark brown. Small brown spots may be observed on both the hindwing and forewing of both sexes although to a varying degree. Females may be darker brown overall with pale checkered markings on the hindwing. Fiery skipper larvae, or caterpillars, are greenish pink-grey with a black head and constricted neck. These larvae are often considered pests and can feed on Bermudagrass, creeping bentgrass, and St. Augustine grass. Phylogenetic and genetic analysis of the fiery skipper revealed three haplotypes (HphH1, HphH26, and HphH31) to be shared in roughly 64.1% of all sampled individuals. Due to this high percentage, these haplotypes likely serve as central haplotypes from which different variations via mutations occurred. Haplotypes HphH22 and HphH23 were found in addition to HphH1, HphH26, and HphH31 to occur in species across all continents with certain haplotypes being prominent in different regions. More variation in haplotype may be observed in South America, suggesting populations may be larger and contain more diversity when compared to those of North America.",https://en.wikipedia.org/wiki/Fiery_skipper
Limenitis arthemis,"Limenitis arthemis is described to be beautiful and highly active. The butterfly species themselves can be divided into two major groups simply from one main characteristic, the white band on the upper wings. However, besides the look of the butterfly, L. arthemis are in constant motion. Their flights are short in duration and at low altitudes, flying only about 2 to 3 feet off the ground. When not in flight, L. arthemis are constantly walking over leaves and folding their wings. They enjoy the sun as many are found to be resting at the highest points on trees. During the short period they are at rest, L. arthemis keep their wings closed, body at a 45 degree angle upwards, and antennae straight forward. The two sexes of this species are identical except that the females are slightly larger than the males. The upperside of L. a. arthemis is mostly blackish-blue with white postmedian bands across both wings. Some individuals have a row of red submarginal spots, while others have this area being blue. The underside of the wings is a blackish color with a broad white post-median band. The basal area of both wings contains many red spots. The submarginal area may contain a row of red spots and the marginal area having bluish spots. However, sometimes the submarginal and marginal areas are just a reddish-brown color. The upperside of L. a. astyanax is very much like L. a. arthemis except it lacks the broad white bands. The forewing submarginal area will sometimes have a row of red spots. The hindwings are either a bright iridescent blue or an iridescent bluish-green. The underside of the wings lacks the white band. The basal area has several red spots. It has a row of red submarginal spots and bluish marginal spots.",https://en.wikipedia.org/wiki/Limenitis_arthemis
Phyciodes tharos,"The pearl crescent (Phyciodes tharos) is a species of butterfly from North America. It is found in all parts of the United States except the west coast, and throughout Mexico and parts of southern Canada, in particular Ontario. Its habitat is open areas such as pastures, road edges, vacant lots, fields, open pine woods. Its pattern is quite variable. Males usually have black antenna knobs. Its upper side is orange with black borders; postmedian and submarginal areas are crossed by fine black marks. The underside of the hindwing has a dark marginal patch containing a light-colored crescent. The wingspan is from 21 to 34 mm. The species has several broods throughout the year, from April–November in the north, and throughout the year in the deep south and Mexico. Adults find nectar from a great variety of flowers including dogbane, swamp milkweed, shepherd's needle, asters, and winter cress. Males patrol open areas for females. The eggs are laid in small batches on the underside of host plant leaves of aster species (family Asteraceae). Caterpillars eat the leaves and are gregarious when young. Hibernation is by third-stage caterpillars.",https://en.wikipedia.org/wiki/Pearl_crescent
Junonia coenia,"Junonia coenia, known as the common buckeye or buckeye, is a butterfly in the family Nymphalidae. It is found as a resident or vagrant across much of North America and Central America, as well as in parts of northern South America. This includes most of the eastern half of the US, the lower to middle Midwest, the Southwest (including most of California), southern Canada, and Mexico. Its habitat includes fields, dunes and scrub, typically in sunny environments up to 1,300 meters (4,300 ft) in altitude. It can be found in open areas with low vegetation and some bare ground. Its original ancestry has been traced to Africa, which then experienced divergence in Asia. The species Junonia grisea, the gray buckeye, is found west of the Rocky Mountains and was formerly a subspecies of Junonia coenia. Caterpillars of these butterflies appear to prefer plants that produce iridoid glycosides, which are bitter compounds that release a hormone called gastrin that activates the digestive system (i.e. hunger); therefore, iridoid glycoside producing plants stimulate and attract their appetites particularly when found in plants like Plantago lanceolata. In fact, the presence of these metabolites may trigger oviposition behaviors in female butterflies so that descendant larval bodies may better incorporate iridoid glycosides. Iridoid glycolyside metabolites appear to have a growth-stimulating effect on caterpillars but a growth-reducing effect on predators. Predators like ants, wasps, birds, and small animals prefer to feed on iridoid glycoside poor caterpillars rather than iridoid glycoside rich larvae, potentially due to these effects. Therefore, immunity of J. coenia larvae to predators like ants appears to be strongly related to the concentration of iridoid glycosides sequestered in their bodies. However, too much iridoid glycosides in the diet can negatively affect the immune response of these larvae and lead to increased susceptibility to parasitism. Adult butterflies feed on flowers with certain pollinator cues: yellow flowers that are ""pre-change"", or flowers whose color has not been changed due to insect visitation or other factors. Common buckeye caterpillars feed in isolation rather than relying upon grouping behaviors. Vulnerability to the Junonia coenia densovirus is another concern for survivorship of common buckeye larvae.",https://en.wikipedia.org/wiki/Junonia_coenia
Noctua pronuba,"A. pronuba, L. 48-56 mm. Antennae in male ciliated. Forewings ochreous-brown to dark fuscous, sometimes reddish tinged, sometimes partly irrorated with grey-whitish, especially towards costa anteriorly; lines often paler, dark-edged, sometimes faint, subterminal preceded on costa by a blackish mark orbicular and reniform more or less pale-edged, outlined with darker, reniform partly marked with dark grey. Hindwings ochreous-orange; a blackish terminal band. Larva pale green to dull brown; dorsal line pale; subdorsal series of blackish longitudinal marks on 5-12; a pale line beneath these; subspiracular pale; head light brown, dark-marked. See Noctua orbona, the lunar yellow underwing and Noctua comes, lesser yellow underwing for differences between these species and pronuba. ^ The flight season refers to the British Isles. This may vary in other parts of the range.",https://en.wikipedia.org/wiki/Large_yellow_underwing
Maniola jurtina,"There is marked sexual dimorphism in this species. The upperside of the male is uniformly light brown with a black ocellus centered white at the apex of the forewing, while the female has a tawny patch more or less extended around this ocella. The underside forewing is ochre-colored bordered with dark beige with the same ocelli at the apex in the male, while the hindwing is greyish to brown with a more or less orange band in the female. The males are also much more active and range far about, while females fly less and often may not move away from the area where they grew up.",https://en.wikipedia.org/wiki/Meadow_brown
Pyrrharctia isabella,"The thirteen-segment larvae are usually covered with brown hair in their mid-regions and black hair in their anterior and posterior areas. In direct sunlight, the brown hair looks bright reddish brown. The setae are uniform in length, unlike in other tiger moth larvae with similar appearance. Adults are generally dull yellowish through orangish and have robust, scaly thoraces; small heads; and bright reddish-orange forelegs. Wings have sparse black spotting. Each abdominal segment bears three black dots. The Isabella tiger moth can be found in many cold and temperate regions. The banded woolly bear larva emerges from the egg in the fall and overwinters in its caterpillar form, by allowing most of its mass to freeze solid. First its heart stops beating, then its gut freezes, then its blood, followed by the rest of the body. It survives being frozen by producing a cryoprotectant in its tissues. This freezing occurs outside of body cells, but not within. In the spring, it thaws. Larval setae do not inject venom and are not urticant; they do not typically cause irritation, injury, inflammation, or swelling. Handling larvae is discouraged, however, because their sharp, spiny hairs may cause dermatitis in some people.",https://en.wikipedia.org/wiki/Pyrrharctia_isabella
Epargyreus clarus,"Epargyreus clarus, the silver-spotted skipper, is a butterfly of the family Hesperiidae. It is claimed to be the most recognized skipper in North America. E. clarus occurs in fields, gardens, and at forest edges and ranges from southern Canada throughout most of the United States to northern Mexico, but is absent in the Great Basin and western Texas. E. clarus larvae create and reside in unique shelters stuck together with silk, which do not protect them from predators. Natural predators of the species include paper wasp foragers, sphecid wasp and Crematogaster opuntiae ants. The species is also considered to be a perching species, meaning that adult males compete for territory to attract females. Although E. clarus is considered to be a pest of a few crop plants such as beans, its pest activity is not serious enough to warrant initiating major control measures.",https://en.wikipedia.org/wiki/Epargyreus_clarus
Nymphalis antiopa,"Nymphalis antiopa, known as the mourning cloak in North America and the Camberwell beauty in Britain, is a large butterfly native to Eurasia and North America. The immature form of this species is sometimes known as the spiny elm caterpillar. Other older names for this species include grand surprise and white petticoat. A powerful flier, this species is sometimes found in areas far from its usual range during migration. These butterflies have a lifespan of 11 to 12 months, one of the longest lifespans for any butterfly. It is the state insect of the U.S. state of Montana, adopted in 2001.",https://en.wikipedia.org/wiki/Nymphalis_antiopa
Battus philenor,"Battus philenor, the pipevine swallowtail or blue swallowtail, is a swallowtail butterfly found in North America and Central America. This butterfly is black with iridescent-blue hindwings. They are found in many different habitats, but are most commonly found in forests. Caterpillars are often black or red, and feed on compatible plants of the genus Aristolochia. They are known for sequestering acids from the plants they feed on in order to defend themselves from predators by being poisonous when consumed. The adults feed on the nectar of a variety of flowers. Some species of Aristolochia are toxic to the larvae, typically tropical varieties. While enthusiasts have led citizen efforts to conserve pipevine swallowtails in their neighborhoods on the West coast, the butterfly has not been the subject of a formal program in conservation or protected in legislation. The butterfly is however of ""Special Concern"" in Michigan, which is on the Northern limit of its range.",https://en.wikipedia.org/wiki/Battus_philenor
Strymon melinus,"The adult gray hairstreak has a wingspan of 20–32 millimetres (0.79–1.26 in). The upper sides of the wings are gray with an orange spot on the hind margin. The underside of the wings are a lighter gray with white and black lines and orange and blue marginal spots near the hind-wings' tail-like extensions. These extensions twitch while at rest, and may imitate a separate head to encourage predators to go for the wings, potentially allowing the insect to survive. Caterpillars are green with markings on the sides, covered in short yellow hairs. Like other caterpillars in the Lycaenidae family, S. melinus are attended by ants in a behavior known as myrmecophily.",https://en.wikipedia.org/wiki/Gray_hairstreak
Aglais urticae,"It is a medium-sized butterfly that is mainly reddish orange, with black and yellow markings on the forewings as well as a ring of blue spots around the edge of the wings. It has a wingspan ranging from 4.5 to 6.2 cm.",https://en.wikipedia.org/wiki/Small_tortoiseshell
Atalopedes huron,Wingspan is 1 to 1+1⁄2 inches (2.5 to 3.8 cm). The males are tawny orange with wide dark borders with prominent wide black stigma on the dorsal view of their wings. Hingwings have dark veins. Females are dark with orange forewing edges; two glassy (hyaline) spots near the center and smaller spots near tip. Ventrally the wings are yellow brown with faint hindwing chevron patterns that frame a yellow brown spot in middle of the hindwing bottom edge. Females are muddier and more olive with the chevron pattern more pronounced.,https://en.wikipedia.org/wiki/Atalopedes_huron
