species,text,url
Xanthorhoe montanata,"The silver-ground carpet (Xanthorhoe montanata) is a moth of the family Geometridae. The species was first described by Michael Denis and Ignaz Schiffermüller in 1775. It is common throughout the Palearctic region (from Ireland to the Russian Far East but not Japan) including the Near East and North Africa.It is found in a variety of different habitats and occurs, for example, in humid forests, moorland and shore areas, on embankments or on unimproved grass meadows and heathlands as well as in gardens. The wingspan is 29–33 mm although some northern races may be smaller. The forewings are white with a broad shaded band which varies from pale grey to almost black. The hindwings are also white with pale fascia and a small black discal spot. In The Macrolepidoptera of the World Louis Beethoven Prout wrote: Another very variable species. In the typical form the median band is pale-centred and the distal area rather weakly marked. - In ab. fuscomarginata Stgr. both are broadly fuscous-margined, containing a distinct white subterminal line. In ab. continuata Krulik the median band is solid, brown or blackish, not interrupted by any white patch. — In ab. degenerata Prout the median area is narrowed and broken into two parts, a larger anterior and a smaller posterior.- ab. costimaculata Rbl. shows only the anterior half of the band. - ab. limbaria Hbn.is a more extreme development, with the band reduced to a very small patch on the discocellulars. - ab. unicolor Rbl. has the wings entirely suffused with smoky black, the median band of the forewing faintly indicated. Taken in S. Yorkshire.In addition to these casual aberrations montanata shows a strong tendency to the formation of local races. Staudinger considers fuscomarginata as such in the Pyrenees,Alps, etc. But in any case the following appear noteworthly: iberica Stgr. high elevations in the mountains of Castile and Andalusia, with the forewing white-yellowish, with less markings and these less distinct,the median band narrowed and more fuscous. - lapponica Stgr. from Northern Scandinavia and N. E. Siberia, a smaller, paler form with the markings (except the discal dot) quite weak. - ab. albicans Strand merely indicates the extreme specimens of lapponica, with the markings (except the discal dot) not or scarcely visible - shetlandica Weir, from the Shetland Islands, is of the same average size as lapponica, but forms a striking contrast to it. It has the forewing much more variegated, the ground-colour suffused with ochreous between the basal and median bands and distally, the median band sharply marked at least at its edges, sometimes pale in the centre, sometimes mixed with bright ochreous brown. The species flies from May to July, usually at dusk. It will come to light but is not strongly attracted. The larva is grey with a purplish-brown back. It has been recorded feeding on bedstraw, Corydalis, globeflower, hemlock and primrose and probably feeds on other low-growing plants. The species overwinters as a larva. ^ The flight season refers to the British Isles. This may vary in other parts of the range.",https://en.wikipedia.org/wiki/Silver-ground_carpet
Colostygia pectinataria,"Colostygia pectinataria, the green carpet, is a Palearctic moth of the genus Colostygia in the family Geometridae. It was first described by August Wilhelm Knoch in 1781. The moth has a wingspan from 22 to 28 millimetres (0.87 to 1.10 in). The strong forewing ground colour is green to bluish green. The wing pattern shows the following colour sequence: a small region at the wing base brown green, the ensuing basal region brighter green, a wide and strongly serrated on the outside discal region dark green edged with white, the postdiscal region whitish green and the marginal region tinted brownish green. There are two distinct blackish spots near the front edge of the wing (costa) and one on the inner edge. In older specimens, the greenish colour can fade. Sometimes newly emerged hatched moths have a whitish, yellowish or pink colour. The hindwings shimmer grey white and have faint lines. The antennae of the males are combed, those of females are simple. The larva is stout, gnarled and light grey violet in colour. It has numerous small black spots that each carry a short, stiff brush. It occurs in many different biotopes, on moors, in marshy terrain and also in forests. The larvae feed primarily on Galium but also on Rumex and Lamium. The moths fly at night in June – July and often come to light. It is a Palearctic species found in the Iberian Peninsula over western and central Europe including the British Isles and east to the Altai Mountains. C. pectinataria reaches the Arctic Circle in Fennoscandia, to the south the occurrence ranges from the western Mediterranean to the Balkan Peninsula, the Black Sea region and the Caucasus. In the mountains C. pectinataria has been recorded at elevations of over 2,000 metres (6,600 ft). Bogs, forests, bushy forest edges and damp heath areas are preferred.",https://en.wikipedia.org/wiki/Colostygia_pectinataria
Leptostales pannaria,"Leptostales pannaria, the pannaria wave moth, is a species of geometrid moth in the family Geometridae. The MONA or Hodges number for Leptostales pannaria is 7173.",https://en.wikipedia.org/wiki/Leptostales_pannaria
Polygonia c-aureum,It has a wingspan of 27 mm. Wings are orange with black dots. The undersides of the wings is mottled brown (tree bark like) with a shiny comma mark on the center of the hindwing. The main difference with other comma species is that it has blueish markings on the bottom of its hindwing.,https://en.wikipedia.org/wiki/Polygonia_c-aureum
Eudonia angustea,"Eudonia angustea is a moth of the family Crambidae described by John Curtis in 1827. It is found in southern and western Europe, the Canary Islands, Madeira and Turkey. The wingspan is 17–22 mm (0.67–0.87 in). The forewings are narrow, whitish, mixed with brownish and sprinkled with black; base darker; lines whitish, dark-edged, first oblique, second sinuate; orbicular outlined with black; claviform black, touching first line; a black X-shaped discal mark, upper half filled with light brownish; subterminal line cloudy, whitish, hardly touching second. Hindwings are whitish-grey, terminally obscurely darker. The larva is blackish-grey, slightly greenish-tinged; spots darker or almost black; head pale brown; plate of 2 dark brown or almost black. Adults are on wing from July to late autumn. The larvae feed on mosses on walls and in sand dunes.",https://en.wikipedia.org/wiki/Eudonia_angustea
Kricogonia lyside,"The lyside sulphur is variable. The upperside of the wings is pale yellow, usually with a black bar on the leading edge of the hindwing and a bright yellow patch near the base of the forewing. Some individuals also have black borders along the costa and apex of the forewing. The underside of the wings varies from a greenish color to bright yellow to almost white. Greener individuals have a whitish vein in the center of the hindwing and a bright yellow forewing basal patch. It has a wingspan of 3.8 to 6 cm (1.5 to 2.4 in).",https://en.wikipedia.org/wiki/Kricogonia_lyside
Ichneutica mutans,"George Hudson described the larva of this species as follows: The larva is rather stout, with the anterior segments wrinkled. It varies much in colour; the dorsal surface is usually reddish-brown; the lateral line is broad and black; a series of subdorsal stripes also black; the ventral surface is green. Sometimes these markings are hardly visible, and the larva is entirely green, whilst occasionally the brown colouring predominates. Walker in his original description of I. mutans described the adult of the species as follows: Male and female. Pale cinereous. Third joint of the palpi cylindrical, full one-third of the length of the second. Antennae of the male minutely ciliated. Thorax with a black curved band in front. Fore wings with black marks along the costa; most of the disk clouded with fawn-colour and with blackish gray; lines almost obsolete, except the submarginal one, which is distinct, whitish, slightly undulating, bordered on each side by black and brown, and interrupted by the black veins; a black discal stripe, dilated towards its tip, and widely interrupted by the space which includes the black-bordered claviform spot; orbicular and reniform spots distinct, partly bordered with black, the former oblique, a little more than half the size of the latter. Hind wings cinereous, with whitish ciliae. Var. Fore wings with the disk hardly clouded; black stripe obsolete, except at each end. Length of the body 6 — 7 lines; of the wings 14 — 16 lines.I. mutans is variable and as a result the species can be confused with I. averilla and I. petrograpta as well as I. bromias despite the fact that the later species is not found in the same area as I. mutans.",https://en.wikipedia.org/wiki/Ichneutica_mutans
Aglossa pinguinalis,"The wingspan is 27 mm (males) and 37 mm (females) (or a forewing length of 14 to 18 mm). The forewings are greyish-ochreous or brownish, densely sprinkled with dark fuscous; a blackish subbasal line; first and second lines obscurely paler, rather broad, waved, cloudily edged with dark fuscous on both sides, second curved outwards in dise; a dark fuscous discal spot. Hindwings fuscous-grey; a paler postmedian line very obscurely indicated. The larva is blackish or dark brown; head blackish: in silken galleries amongst chaff and hay refuse.",https://en.wikipedia.org/wiki/Aglossa_pinguinalis
Pyrausta acrionalis,"Pyrausta acrionalis, the mint-loving pyrausta moth, is a moth of the family Crambidae. It is found in eastern North America, including Alabama, Georgia, Massachusetts, Mississippi, New Hampshire, New York, Ontario, Tennessee, West Virginia and Wisconsin. The wingspan is 14–18 mm. The larvae feed on the leaves of Mentha species. == References ==",https://en.wikipedia.org/wiki/Pyrausta_acrionalis
Smerinthus ocellata,"Smerinthus ocellatus, the eyed hawk-moth, is a European moth of the family Sphingidae. The species was first described by Carl Linnaeus in his 1758 10th edition of Systema Naturae. The eyespots are not visible in resting position, where the forewings cover them. They are displayed when the moth feels threatened, and may startle a potential predator, giving the moth a chance to escape.",https://en.wikipedia.org/wiki/Smerinthus_ocellatus
Charaxes jasius,"Charaxes jasius is a medium to large butterfly with a wingspan reaching 76–83 mm in males, the female being larger. Males up to 80–100 mm wingspan, with females even larger, may be found in Morocco. Each hindwing bears two tails, characteristic of most species of the genus. The spring seasonal brood is smaller in size compared with the second and sometimes third broods, and the two tails on each hindwing tend to curve somewhat towards each other resembling a pincer, less so in the later broods with slightly longer straighter tails. The upperside ground colour of the wings is dark brownish-black, with some changeable purplish sheen viewed at varying angles; forewing with suggestion of darker discal bars, postdiscal spots orange; hindwing with whitish patch near costal border, dusted with brownish scales; outer border of both wings deep orange-ochreous, divided by black-scaled veins. Hindwing with small submarginal blue spots, often vestigial; more developed in the female. There is some variation in the intensity of the ground colour, and in development of the postdiscal orange spots. The underside has a very characteristic mosaic appearance broadly similar to a number of related species, traversed by a jumble of bands and of brown, reddish, greyish and blackish patches, all edged with a filigree of white. Beyond the inner mosaic, a white complete discal band bridges across fore- to hindwings. The outer orange marginal coloration is present on the underside also. The female resembles the male but is larger.",https://en.wikipedia.org/wiki/Charaxes_jasius
Rheumaptera meadii,"Coryphista is a monotypic moth genus in the family Geometridae erected by George Duryea Hulst in 1896. The genus may be considered to be a synonym of Rheumaptera. Its only species, Coryphista meadii, the barberry geometer moth or barberry looper, was first described by Alpheus Spring Packard in 1874. It is found in the United States and southern Canada. The wingspan is 30–36 mm. Adults are on wing from April to October. There are several generations per year. The larvae feed on Berberis species (barberries), an introduced shrub in most of eastern North America.",https://en.wikipedia.org/wiki/Coryphista
Maruca vitrata,"Maruca vitrata is a pantropical insect pest of leguminous crops like pigeon pea, cowpea, mung bean and soybean. Its common names include the maruca pod borer, bean pod borer, soybean pod borer, mung moth, and the legume pod borer. The species was first described by Johan Christian Fabricius in 1787. It can cause losses of 20–80% on the harvests of cowpeas. Its feeding sites on plants are flower buds, flowers and young pods. In some cases early instars feed on flower peduncles and young stems.",https://en.wikipedia.org/wiki/Maruca_vitrata
Homoeosoma electella,"Homoeosoma electellum, the American sunflower moth, is a species of moth of the family Pyralidae. It is native to North America but also found in South America. Its larvae eat the flowers and developing seeds of many asters, including echinacea. The wingspan is 18–20 mm. The larvae are a pest of canola and sunflowers. Other recorded food plants include cotton and oranges. == References ==",https://en.wikipedia.org/wiki/Homoeosoma_electellum
Citheronia regalis,"Citheronia regalis, the regal moth or royal walnut moth, is a North American moth in the family Saturniidae. The caterpillars are called hickory horned devils. The adult (imago) has a wingspan of 3.75–6.1 in (9.5–15.5 cm). The species was first described by Johan Christian Fabricius in 1793.",https://en.wikipedia.org/wiki/Citheronia_regalis
Lycia hirtaria,"The brindled beauty has a wingspan of 4–5 cm. It is a large-bodied furry moth, which has a pattern which provides near-perfect camouflage on tree trunks and also gives the moth its name. The forewing ground colour is usually grey with black dusting. There is a curved anterior and a curved exterior cross line limiting the midfield. The Hindwings are also grey and have two or three crosslines. The females have a pale yellow suffusion on the wings and the front edges of their forewings are paler. The males show large comb-like antennae. Variation female-ab. terroraria Krulik. is described as unicolorous grey, with weak traces of the lines on the veins of the forewing. Female -ab. fumaria Haw. is fuscous or smoky black, in extreme examples entirely unmarked.- diniensis Ob. differs little from the name-type, but the lines appear to be very strong and thick. Figured without description. Basses-Alpes.- ab. fasciata [Prout] is a beautiful modification of diniensis with the antemedian line double and with a blackish band extending from the median line of the forewing to the subterminal. Le Canadel. Var, France, - ab. flavescens [Prout] may be taken as the name of the more yellow-mixed form which is common in England, N. France, etc.- ab. congeneraria Hbn. has the antemedian and postmedian lines very distinctly double. Possibly forms a separate race in Algeria - istriana Galv. is a large, whitish-mixed form from Istria- hanoviensis Heymons is a small race, more densely scaled, the ground-colour more mixed with ochreous-yellow, the dark markings extended into strong suffusions.",https://en.wikipedia.org/wiki/Brindled_beauty
Manduca quinquemaculatus,"Manduca quinquemaculata, the five-spotted hawkmoth, is a brown and gray hawk moth of the family Sphingidae. The caterpillar, often referred to as the tomato hornworm, can be a major pest in gardens; they get their name from a dark projection on their posterior end and their use of tomatoes as host plants. Tomato hornworms are closely related to (and sometimes confused with) the tobacco hornworm Manduca sexta and Blackburn's sphinx moth Manduca blackburni. This confusion arises because caterpillars of both species have similar morphologies and feed on the foliage of various plants from the family Solanaceae, so either species can be found on tobacco or tomato leaves. Because of this, the plant on which the caterpillar is found does not indicate its species.",https://en.wikipedia.org/wiki/Manduca_quinquemaculata
Machimia tentoriferella,"The gold-striped leaftier moth (Machimia tentoriferella) is a moth of the family Depressariidae. It is found in North America from Nova Scotia to North Carolina and Tennessee, west to Mississippi and Iowa, north to Ontario. The binomial name tentoriferella refers to Latin tentorium (meaning ""a tent""), this probably is a reference to the rolled or tied leaf enclosure made by the larva. The wingspan is 20–26 mm. Adults fly from September to October depending on the location. The larvae feed on Fraxinus americana and Fraxinus nigra. Other recorded food plants include birch, elm, maple, oak, basswood, butternut, cherry, beech, hickory, balsam poplar, chestnut, hazel, apple, lilac and dogwood.",https://en.wikipedia.org/wiki/Machimia_tentoriferella
Nemophora degeerella,"The wingspan of Nemophora degeerella ranges from 18–20 millimetres (0.71–0.79 in) in males, from 15–18 millimetres (0.59–0.71 in) in females. The head is dark brown, with dark and yellow hair-like scales. The thorax has a bronzy golden shining. Forewings are shiny bronzy golden yellow or shiny ochreous with longitudinal dark brown and lead-gray blueish-violet shining streaks. A yellow transversal band cross the whole forewings, framed by two lead-gray blueish-violet shining stripes with a dark brown border. The three longitudinal lead-gray, blueish-violet shining stripes situated in the basal part of the wings do not treach the transversal fascia. Rear wings are brownish gray. The longhorn moth males have filiform antennae ranging up to five times their body length, while the female has much shorter antennae. Moreover in the females the basal part of the antennae is thickened by black scales, while the tip is white. Nemophora degeerella is very similar to Nemophora congruella but N. congruella is slightly smaller, the forewing markings are bright yellow and the band is located closer to the base. In the females of N. congruella is missing the beard-like scales present in the basal part of the antennae of the females of N. degeerella. Also Adela croesella is very similar, but it is much smaller and more colorful. The gray blueish-violet stripes are at least as wide as the yellow central band.",https://en.wikipedia.org/wiki/Longhorn_moth
Limochores mystic,"Limochores mystic, the long dash or long dash skipper, is a species of butterfly. The species is commonly found in north of North America and in mountains in the south of North America, in grassy habitats. The grassy areas include meadows, marshes, streamsides, wood edges, and prairie swales. On the top, the species has dark brown reddish to yellowish-orange markings. The forewing of the female has a broad black patch at the base. The forewing of the male has a long, slightly curved stigma which may be connected to the dash near the apex. Underneath the hindwing, the species is orange brown with a curved band of equal-sized yellow spots. == References ==",https://en.wikipedia.org/wiki/Limochores_mystic
Elaphria versicolor,"Elaphria versicolor (variegated midget) is a species of moth in the family Noctuidae. It is found in north-eastern North America, including Ontario and Ohio. This wingspan is about 22 mm. The moth flies from May to July depending on the location. The larvae feed on balsam fir, hemlock, pine, spruce, yellow birch and white cedar.",https://en.wikipedia.org/wiki/Elaphria_versicolor
Callima argenticinctella,"Epicallima argenticinctella, the orange-headed epicallima moth, is a moth of the family Oecophoridae. It is found in North America, where it has been recorded from Nova Scotia to South Carolina, west to Kansas and Texas. The habitat consists of deciduous forests. The wingspan is 10–13 mm. The forewings are yellowish-orange with a silvery black-margined line along the basal margin from the fold to the basal angle. There is a similar line from the basal third of the inner margin to the costa. The basal area between these lines is deep reddish orange. The hindwings are fuscous. Adults are on wing from April to October. == References ==",https://en.wikipedia.org/wiki/Epicallima_argenticinctella
Vanessa braziliensis,"Vanessa braziliensis, the Brazilian painted lady, is a butterfly of the family Nymphalidae found in Brazil, Ecuador, Peru, Bolivia, Venezuela, Paraguay, Uruguay and northern Argentina.",https://en.wikipedia.org/wiki/Vanessa_braziliensis
Colobura dirce,"Colobura dirce, the mosaic or zebra mosaic, is a butterfly of the family Nymphalidae. It is found in Central America. the Caribbean, and northern South America. The length of the forewings is about 33 mm. The larvae feed on Cecropia species.",https://en.wikipedia.org/wiki/Colobura_dirce
Neptis sappho,"Neptis sappho, the Pallas' sailer or common glider, is a nymphalid butterfly found in Central Europe, Russia, India and other parts of temperate Asia and Japan. The wingspan is 40–46 mm.The upper side of the forewings is black or black-brown in ground colour with a band of white spots. Two white, wedge-shaped spots are also found between the band and the wing base. The underside is rusty brown and otherwise shows the same white markings as the upper side. The upper side of the hind wings is also black or black-brown in colour with a broad inner and a narrow outer band, each white with a white band, which are only broken by the dark veins. In contrast to the very similar Neptis rivularis, the white markings are more extensive and have two rows on the hind wings. The rusty brown underside is slightly lighter than in N. rivularis. The larvae feed on Lathyrus vernus, Lathyrus niger and Robinia pseudoacacia. == References ==",https://en.wikipedia.org/wiki/Neptis_sappho
Olethreutes fasciatana,"Olethreutes fasciatana is a moth of the family Tortricidae. It is known from North America, including Alabama, Illinois, Maryland, Massachusetts, New Jersey, New York, North Carolina, Ohio, Oklahoma, Pennsylvania and Wisconsin. The wingspan is about 15 mm. Adults have been recorded in June. The larvae feed on Salix and Populus species.",https://en.wikipedia.org/wiki/Olethreutes_fasciatana
Acronicta psi,"Acronicta psi has a wingspan of 34–45 mm (1.3–1.8 in). These moths have grey forewings with bold black dagger-shaped markings. (The Latin specific name also refers to these markings, as resembling the Greek letter psi, ψ.) The hindwings are dirty grey, generally paler in the male. The moth is very similar to the dark dagger (Acronicta tridens) and identification is generally only possible by minute examination of the genitalia. See Townsend et al. However, in general this moth is generally darker in colour than the dark dagger and always lacks the white hindwings often present in the male of that species. Moreover, the larvae of the two species are very different. The larva of Acronicta psi is quite hairy, greyish or brownish below and black above, with red spots along the sides and a bold yellow stripe along the back. It has a distinctive horn just behind the head (absent from the larva of dark dagger).",https://en.wikipedia.org/wiki/Grey_dagger
Cryphia algae,"Cryphia algae, the tree-lichen beauty, is a moth of the family Noctuidae. The genus was erected by Johan Christian Fabricius in 1775. It is found in Mediterranean parts of Europe and the Near East.",https://en.wikipedia.org/wiki/Cryphia_algae
Hippotion celerio,"Hippotion celerio, the vine hawk-moth or silver-striped hawk-moth, is a moth of the family Sphingidae. It was described by Carl Linnaeus in his 1758 10th edition of Systema Naturae.",https://en.wikipedia.org/wiki/Hippotion_celerio
Anisota virginiensis,The female's wings are purplish red with ochre-yellow. They have thin scales and are almost transparent. The male's wings are purplish brown with a large transparent space in the middle. The female is larger than the male. The wing span is 4.2 to 6.6 centimeters.,https://en.wikipedia.org/wiki/Anisota_virginiensis
Eilema depressa,"Katha depressa, the buff footman, is a moth of the family Erebidae found in Asia and Europe. It was first described by Eugenius Johann Christoph Esper in 1787.",https://en.wikipedia.org/wiki/Katha_depressa
Caenurgia chloropha,"Caenurgia chloropha, the vetch looper moth, is a moth of the family Erebidae. The species was first described by Jacob Hübner in 1818. It is found in the south-eastern United States, northern Mexico and Cuba. Strays may be found as far north as southern Ontario. The wingspan is about 27–36 mm. There are two or more generations per year with adults on wing from April to October. The larvae feed on vetch and other legumes. Full-grown larvae may be found from May onward. == References ==",https://en.wikipedia.org/wiki/Caenurgia_chloropha
Diacrisia sannio,"Diacrisia sannio, the clouded buff, is a moth of the family Erebidae. The species was first described by Carl Linnaeus in his 1758 10th edition of Systema Naturae.",https://en.wikipedia.org/wiki/Diacrisia_sannio
