species,text,url
Nymphalis polychloros,"Nymphalis polychloros has a wingspan of 68–72 millimetres (2.7–2.8 in) in males, of 72–75 millimetres (2.8–3.0 in) in females. These medium to large butterflies have orange to red wings with black and yellow patches. Both wings with yellowish submarginal lunules, upon which follows a black band which is likewise composed of lunules and bears on the hindwing small blue spots. The underside of the wings is smoky brown with darker shades and black transverse pencilling. There is no sexual dimorphism. This species looks very similar to the small tortoiseshell (Aglais urticae), but it is more closely related to the Camberwell beauty and Nymphalis xanthomelas It differs from the small tortoiseshell by its larger size (45–62 mm. wingspan in Aglais urticae) and by the more orange ground colour of the upper surface of its wings and the orange base of its hindwings. The forewing is orange-brown, with 3 costal black blotches, 3 large black spots in the disc posteriorly and a narrow blackish terminal band – less bright than those of A. urticae, and lacking the apical white spot and the marginal blue dots of that species. Compared to the yellow-legged tortoiseshell it has yellower interspaces between the black blotches on the costal edges of its forewings and the dark marginal band is narrower. The surest way to recognize it, however, is by its dark haired tarsi yellow-legged tortoiseshell's tarsal hairs are light-coloured.",https://en.wikipedia.org/wiki/Large_tortoiseshell
Argynnis adippe,"The high brown fritillary's wingspan is on average around 65 mm. Its upper wings are orange with black markings and the undersides are colored a duller orange with white and brown markings. While flying, it is very hard to distinguish from the dark green fritillary which has many of the same markings. The male and female fritillary share many of the same physical features. Larvae are brown with a single longitudinal white stripe down the length of their body. Their bodies are covered in brown spikes which aid in camouflaging them from predators as they move among dead fern fronds.",https://en.wikipedia.org/wiki/High_brown_fritillary
Delias pasithoe,"Delias pasithoe, the redbase Jezebel is a medium-sized butterfly of the family Pieridae, that is, the yellows and whites. The species is found in parts of South Asia and Southeast Asia. There has been some dispute for which species the specific name aglaja (or aglaia), used twice by Linnaeus in 1758, applies – the redbase Jezebel, or the dark green fritillary (Speyeria aglaja), a brush-footed butterfly. Here, Delias pasithoe is used for the redbase Jezebel, based on the replacement name proposed by Linnaeus himself.",https://en.wikipedia.org/wiki/Delias_pasithoe
Harrisina americana,"The adult has narrow black wings, usually held away from the body at rest, and a reddish collar. The wingspan is 18–28 mm, the length 8–12 mm. The larva has a dark head; the body is yellow with a complete black band across each abdominal segment. The larvae can reach up to 15 mm in length.",https://en.wikipedia.org/wiki/Grapeleaf_skeletonizer
Maliattha synochitis,"Maliattha synochitis, the black-dotted maliattha or black-dotted lithacodia, is an owlet moth in the family Noctuidae. The species was first described by Augustus Radcliffe Grote and Coleman Townsend Robinson in 1868. The MONA or Hodges number for Maliattha synochitis is 9049.",https://en.wikipedia.org/wiki/Maliattha_synochitis
Melipotis indomita,"Melipotis indomita, the indomitable melipotis, is a moth in the family Erebidae. The species was first described by Francis Walker in 1858. It is found from the West Indies to Mexico, and from Maine, Florida and Minnesota to Texas and California. The wingspan is 40–55 mm. There are multiple generations per year. The larvae feed on Prosopis species. == References ==",https://en.wikipedia.org/wiki/Melipotis_indomita
Anarta trifolii,"This is a small to medium (wingspan 33–39 mm) species with cryptically coloured forewings, varying from light to dark brown, sometimes with a reddish tinge. The most characteristic feature is a distinctively W-shaped, white subterminal line. This feature is seen on some other noctuids, but usually much larger species. The hindwings are grey or buff, darker towards the termen, and marked with dark veins.",https://en.wikipedia.org/wiki/Nutmeg_(moth)
Eurema daira,"Eurema daira, the fairy yellow, barred yellow or barred sulphur, is a butterfly of the family Pieridae. The species was first described by Jean-Baptiste Godart in 1819. It is found from Argentina north to the southern United States. Strays can be found up to southern Arizona, South Dakota, southern Texas and even Washington, D.C. The wingspan is 32–41 mm. Adults are on wing year round in the southern part of the range and in late summer and fall as vagrant. The larvae feed on Fabaceae species, including Stylosanthes biflora and Aeschynomene species. Adults feed on the nectar of various flowers including joint vetches and shepherd's needle, and are the principal pollinators of Cnidoscolus urens.",https://en.wikipedia.org/wiki/Eurema_daira
Nemoria bistriaria,"Nemoria bistriaria, the red-fringed emerald or two-striped emerald, is a species of moth of the family Geometridae. It is found from New Brunswick to Florida, west to Central Coast of California, north to Ontario. The wingspan is about 22 mm. Adults are on wing from March to October in the south and from May to August in the north. There are at least two generations per year.",https://en.wikipedia.org/wiki/Nemoria_bistriaria
Limenitis camilla,"L. Camilla L. (= sibilla L., aucl. cet.)(57a, b). Very similar to the preceding species [sydyi L. sydyi Led. (female 57a). Blackish brown, with white spots on the forewing and a strongly elbowed white band on the hindwing; at the apex of the forewing, especially in the female, some reddish brown smears. Underside for the most part brownish, the hindwing bluish at the base and abdominal margin, in the distal area with 2 rows of blackish spots, the spots of the outer row being lunate and forming the borders of a further row of whitish spots. The females have a less intense ground-colour, the whitish submarginal spots of the hindwing and the light and reddish patches in the cell of the forewing are more distinct.]; however, the position of the spots of the forewing is different and the band of the hindwing is but slightly curved, not elbowed; on the underside the black spots in the marginal area of the hindwing are all rounded, there being no band of light spots outside them as in sydyi[ Limenitis sydyi Kindermann, 1853 East Palearctic].",https://en.wikipedia.org/wiki/Limenitis_camilla
Cydia pomonella,"Codling moths are not large, as the full grown adult codling moth has an average length of 10 mm and wingspan of 20 mm. The wings fold into a tent-like shape when the moths are resting. They are distinguished from other similar moths in the family Tortricidae by the distinctive patterns on their fore-wings. These brown spots enclosed in gold rings are called ""little mirrors"" because they resemble small mirrors with a golden rim. The slender antennae are mildly curved near the distal end. The dorsal side of the abdomen is smooth and bare, while the ventral side is covered in scales. Though most of the moths are brown or gray in color, it has been observed that the maturity of the fruits the larvae feed on can lead to variation in color in the adult moth.",https://en.wikipedia.org/wiki/Codling_moth
Anatrytone logan,"Both females and males are yellow orange with black borders and dark brown veins on their wings. The borders are broader on the front and back edges of the hindwing. ""The underside is yellowish orange, lacking any markings except a narrow dark border on the forewing."" The wingspan is 2.5 to 4.3 centimeters.",https://en.wikipedia.org/wiki/Anatrytone_logan
Phalanta phalantha,"The common leopard is a medium-sized butterfly with a wingspan of 50–55 mm with a tawny colour and marked with black spots. The underside of the butterfly is more glossy than the upper and both the male and female are similar looking. A more prominent purple gloss on the underside is found in the dry-season form of this butterfly. Male aud female. Upperside bright yellowish-ochreous. Forewing with two black short slender sinuous bars across middle of the cell, a similar darker pair at its end, followed beyond by a short broad sinuous streak from the costa to the lower radial, and is then succeeded below the cell by an inwardly-oblique series of four irregular-shaped spots, and beyond by a medial-discal transverse row of similarly disposed narrow spots, an outer-discal row of round spots, then an inner submarginal sinuous line, confluent with an outer straight line, and a marginal row of triangular spots. Hindwing with a slightly-defined slender black lunule within the cell, two before its end, and two also above it; a transverse inner-discal irregular series of slender lunules which are slightly pale bordered externally; a medial-discal row of four larger black oval spots, two submarginal sinuous slightly confluent lines, and marginal triangular spots. Underside paler, and with all the markings, as on upperside much less defined; the interspaces of cell-bars and outer markings suffused with violet-grey, and the inner-discal series outwardly bordered with greyish lunules. In some specimens, presumably dry-season, all the markings on the upper and underside are less prominent. Body and palpi above yellowish-ochreous; beneath and also femora beneath greyish-white; tibia and tarsi pale ochreous; antennae ochreous-brown.",https://en.wikipedia.org/wiki/Phalanta_phalantha
Dione moneta,"D. moneta has an orange upperside, and the wing bases are brown in color. It has thick, dark veins. The hind wing of the underside of these butterflies is brown and covered in big, silver spots. Its wings span from 3 – 3 and 1/4 inches.",https://en.wikipedia.org/wiki/Dione_moneta
Hypsopygia costalis,"Hypsopygia costalis, the gold triangle or clover hay moth, is a species of moth of the family Pyralidae. It was described by Johan Christian Fabricius in 1775 and is found in Europe. The wingspan is 16–23 mm.The forewings are purple, sometimes blackish-sprinkled; median part of costa dotted with yellow; lines yellow, nearly straight, forming large spots on costa; a terminal line and cilia yellow. Hindwings as forewings, but lines much nearer together, irregularly curved, not forming costal spots. The adult moths fly from May to July, depending on the location. The supposed species H. aurotaenialis is included here pending further study. The caterpillars feed on dry vegetable matter. They have been found in haystacks or thatching, as well as in chicken (Gallus) and magpie (Pica) nests. The caterpillar is injurious to clover hay, and to other hay when mixed with clover. Its depredations can be prevented by keeping the hay dry and well ventilated, as the insect preferably breeds in moist or matted material such as is to be found in the lower parts of haystacks, where affected hay becomes filled with webbings of the caterpillars and their excrement, rendering it unfit for feeding. A treatment is to burn the webbed material and to thoroughly clean the affected location.",https://en.wikipedia.org/wiki/Hypsopygia_costalis
Idia lubricalis,"Idia lubricalis, the glossy black idia, is a litter moth of the family Erebidae. The species was first described by Carl Geyer in 1832. It is found from Canada south to Florida and Texas in deciduous forests. Idia occidentalis was formerly considered a subspecies of Idia lubricalis. The wingspan is 24–36 mm. Adults are on wing from May to September. There are multiple generations per year in the south. The larvae feed on various fungi and lichens. They probably feed on other organic matter like rotting wood and grass on forest floor as well.",https://en.wikipedia.org/wiki/Idia_lubricalis
Orthosia incerta,"Orthosia incerta, the clouded drab, is a species of moth of the family Noctuidae, found in Europe and Asia. The occurrence of the species extends through all European countries through the Palearctic to the Russian Far East and Japan. It is absent from northern Fennoscandia and in the Alps it occurs up to 2000 m above sea level.",https://en.wikipedia.org/wiki/Orthosia_incerta
Polygonia gracilis,"The hoary comma (Polygonia gracilis) is a species of butterfly, common in boreal North America from Alaska, across southern Canada to New England and the Maritime Provinces and south to New Mexico from the Rocky Mountains to the Pacific Ocean. The wings have a distinctive ragged edge. Adult butterflies feed on tree sap and nectar from sweet everlasting (Gnaphalium) as well as other flowers. Caterpillars feed on shrub leaves including currant (Ribes), western azalea (Rhododendron occidentale) and mock azalea (Rhododendron menziesii). The species survives the winter in the adult stage in diapause and mate and lay eggs in the spring. Butterflies emerge from their chrysalids in midsummer.",https://en.wikipedia.org/wiki/Hoary_comma
Panopoda rufimargo,"Panopoda rufimargo, the red-lined panopoda, is an owlet moth in the family Erebidae. The species was first described by Jacob Hübner in 1818. It is found in North America. Caterpillars feed on pignut hickory and northern red oak. The MONA or Hodges number for Panopoda rufimargo is 8587.",https://en.wikipedia.org/wiki/Panopoda_rufimargo
Ochropleura implecta,"Ochropleura implecta is a moth of the family Noctuidae. It is found from Newfoundland to South Carolina, west to Arizona, north to British Columbia. This species was described in 1998 by Don Lafontaine, who distinguished it from the very similar Ochropleura plecta which occurs in Europe and Asia. The wingspan is 25–32 millimetres (0.98–1.26 in). Adults are on wing from April to September. There are two generations per year. The larvae feed on various plants, including beet, clover, chicory and willow.",https://en.wikipedia.org/wiki/Ochropleura_implecta
Cameraria ohridella,"The moth is up to 5 millimetres (3⁄16 inch) long, with shiny, bright brown forewings with thin, silvery white stripes. The hindwings are dark grey with long fringes. Each female moth lays between 20 and 40 eggs singly on the upper surface of leaves, and once these hatch 2–3 weeks later, the larvae develop through five feeding phases (or instars) and two prepupal (spinning) phases before the pupal phase. The first stage creates a small cavity (or mine) parallel to a vein in the leaf and is ""sap-sipping"" rather than ""tissue-feeding"". By the third instar, the larva creates a mine approximately 8mm in diameter; this is further expanded by later instars until one mine can cover several square centimeters. The larva starts to pupate around four weeks after the egg hatches and, except when hibernating as a pupa in the mine, the adult emerges around two weeks later. In severe infestations, the mines of individuals can merge and almost the entire leaf area may be utilised. When this occurs it may lead to high moth mortality as the larvae compete for space and food. The moth is able to go through up to five generations each year, if the weather is hot and dry; on average in western Europe, the moth goes through three generations each year. The last generation of the year pupates for over six months so as to survive the winter. The pupae are extremely frost tolerant and have been recorded to survive temperatures as low as −23 °C (−9 °F). This allows its populations to increase even after hard winters. The dead patches that the horse-chestnut leaf miner causes on leaves are similar to damage caused to horse-chestnut trees by the fungus Guignardia aesculi, but can be distinguished by the fungal infection often being outlined by a conspicuous yellow band which the mines lack. The pupae can be mistaken for pupae of the genus Phyllonorycter but can be distinguished because C. ohridella pupae do not have a cremaster and the first five abdominal sections have strong lateral spines on them.",https://en.wikipedia.org/wiki/Horse-chestnut_leaf_miner
Polygonia satyrus,"Polygonia satyrus, the satyr comma, is a North American butterfly of the nymphalid family. It is primarily found in western Canada, where it is locally common. It bears a resemblance to Polygonia comma, the eastern comma, with which it is frequently confused. Its caterpillars feed on Urtica gracilis, the American stinging nettle.",https://en.wikipedia.org/wiki/Polygonia_satyrus
Euphyia intermediata,"Euphyia intermediata, the sharp-angled carpet, is a moth of the family Geometridae. The species was first described by Achille Guenée in 1858. It is found from coast-to-coast in southern Canada and the northern United States, south in the east to North Carolina, south in the west to California, Utah, and possibly Arizona. It is also found north to the Northwest Territories and Alaska. The European species Euphyia unangulata was previously thought to be Holarctic. The name was therefore also applied to the North American populations. Malcolm J. Scoble et al. in Geometrid Moths of the World (1999) split them into distinct species. The wingspan is 21–27 mm. Adults are on wing from April to September. There is one generation per year. The larvae feed on various plants, including bedstraw, carnation, chickweed, elm, and mustard.",https://en.wikipedia.org/wiki/Euphyia_intermediata
Leuconycta diphteroides,"Leuconycta diphteroides, the green leuconycta moth or green owlet, is a moth of the family Noctuidae. The species was first described by Achille Guenée in 1852. It is found in North America from Nova Scotia to Florida, west to Texas and north to Saskatchewan. The wingspan is 27–32 mm. Adults are on wing from May to September. The larvae feed on Solidago and Aster species. == References ==",https://en.wikipedia.org/wiki/Leuconycta_diphteroides
Caradrina clavipalpis,"The wingspan is 26–35 mm. The length of the forewings is 12–15 mm. Forewing pale to dark grey with darker dusting and sometimes tinged with ochreous; the terminal area generally fuscous; the lines starting from black costal spots; the inner and outer double, blackish, the inner minutely waved, the outer dentate; subterminal line pale, waved, preceded by a grey shade with dentate rufous marks in it; stigmata small, fuscous, the orbicular rounded, the reniform a narrow lunule, with two white dots on its inner edge and three on outer; hindwing white, the veins and termen dark grey; — in laciniosa Donz. the subterminal line consists of a row of three yellowish spots each extended to termen; — the form leucoptera Thnbg., from Scandinavia, Finland, and the Ural Mountains, has fuscous suffusion over the head, thorax, and forewing, the hindwing remaining white.",https://en.wikipedia.org/wiki/Caradrina_clavipalpis
Alcis repandata,"Alcis repandata has a wingspan reaching 30–45 mm. This is an extremely variable species, typically being buff or grey with black bars along the costa, but often with a broad blackish band across the forewings. Meyrick describes it - The head is grey mixed with whitish and fuscous. The forewings are light ochreous-brown, sprinkled with black and sometimes with whitish. The first line is curved, the median line is twice sinuate and dark fuscous, sometimes partly confluent. The second line is dark fuscous, roundly projecting above and below the middle. The subterminal is waved and pale or whitish, partially dark-margined. There is a blackish discal spot before the median. The hindwings are as the forewings, but the lines are less marked and regular. There is a discal dot beyond median. Melanic forms are also common, especially in industrial areas. In all but the darkest variations the most characteristic feature is a pale zigzag line across the hindwing. The larva is pale greenish-ochreous, brown-marked, sometimes suffused with dark grey, dusted with yellow. The dorsal line is brown or dark grey, distinct on segments 2–4, often obsolete elsewhere. Segments 5-12 sometimes have pale dorsal diamonds. See also Prout (1912–16) This species is rather similar to Willow Beauty (Peribatodes rhomboidaria) and its congeners. See Townsend et al.",https://en.wikipedia.org/wiki/Mottled_beauty
Anageshna primordialis,"Anageshna is a monotypic moth genus of the family Crambidae described by Eugene G. Munroe in 1956. Its only species, Anageshna primordialis, the yellow-spotted webworm, was described by Harrison Gray Dyar Jr. in 1907. It is found in the US states of Alabama, Arkansas, Arizona, Florida, Georgia, Iowa, Illinois, Kansas, Louisiana, Massachusetts, Maryland, Maine, Minnesota, Missouri, Mississippi, North Carolina, New Hampshire, New Jersey, New York, Ohio, Oklahoma, Pennsylvania, South Carolina, Texas, Virginia and West Virginia. The wingspan is about 11 mm (0.43 in). Adults are on wing from August to November. Its host plants are unknown.",https://en.wikipedia.org/wiki/Anageshna
Danaus erippus,"Danaus erippus is included with other Nymphalidae, the largest family of butterflies with about 6000 species distributed throughout most of the world. It has a reduced pair of forelegs, is brightly coloured, and is included with popular species such as the emperors, admirals, tortoiseshells, and fritillaries. Its wingspan reaches about 110 millimetres (4.3 in), with an easily recognizable orange and black pattern. Until 2007, this butterfly was treated as a subspecies of Danaus plexippus. These species are very similar, but D. erippus usually has an orange trailing edge of the forewings, while in D. plexippus it is black. The lineages of the two species are thought to have separated about 2 million years ago. The colour of the wings in males of the southern monarch is paler than in the females.",https://en.wikipedia.org/wiki/Danaus_erippus
Utetheisa pulchella,"The wingspan of Utetheisa pulchella can reach 29–42 mm. The front wings are narrow, white or cream coloured with a variable pattern of numerous small black spots located between the larger-sized bright red spots. Sometimes the red spots are merged to transversal bands. The hindwings are wide, white, with an irregular black border along the outer edge and two black markings in the middle of the cell. The head and thorax range from cream colour to buff yellow, with the same pattern as the wings. The antennae are long and monofiliform. The abdomen is smooth, with a white background. Caterpillars are warty, dark brown or greyish, with tufts of greyish hairs, an orange crossline on each segment, a wide whitish line along the back and two other lateral white lines.",https://en.wikipedia.org/wiki/Utetheisa_pulchella
Pococera asperatella,"Pococera asperatella, the maple webworm moth, is a moth of the family Pyralidae. It is found in North America, including Alabama, Illinois, Massachusetts, Minnesota, New Hampshire, New Jersey, North Carolina, Oklahoma, Ontario, Pennsylvania, South Carolina, Tennessee, Texas, Virginia and Wisconsin. Adults are powdery gray. There is one generation per year. The larvae have been recorded feeding on the foliage of various hardwood species, including Rhus and Acer species. == References ==",https://en.wikipedia.org/wiki/Pococera_asperatella
Phrissogonus laticostata,"Phrissogonus is a monotypic moth genus in the family Geometridae erected by Arthur Gardiner Butler in 1882. Its only species, Phrissogonus laticostata, the apple looper, was first described by Francis Walker in 1862. It is found in Australia, New Caledonia and New Zealand.",https://en.wikipedia.org/wiki/Phrissogonus
Synchlora frondaria,"Synchlora frondaria, commonly known as the southern emerald, is a species of emerald moth in the family Geometridae. It is found in the Caribbean, Central America, North America, and South America.",https://en.wikipedia.org/wiki/Synchlora_frondaria
Pieris canidia,"The male is white to pale cream on its upperside. The base of the forewing, the basal portion of the costa, and the base and upper margin of the cell have a scattering of black scales. It is black from the apex to about the middle of the terminal margin. On the latter the black extends for a very short distance triangularly along the veins. There is a round black spot in interspace 3. The hindwing has a subcostal black spot as in Pieris rapae but is generally larger and more conspicuous, and a series of four or five terminal black spots that vary in size at the apices of the veins. Underside: the forewing is white; cell and costa are lightly irrorated (speckled) with black scales; apex is somewhat broadly tinged with ochraceous yellow. Interspaces 1, 3 and 5 have conspicuous subquadrate black spots; the spot in interspace 1 sometimes extends out of interspace 1. That in interspace 5 is ill-defined. Hindwing: from pale, almost white, to dark ochraceous, thickly irrorated all over (with the exception of a longitudinal streak in the cell, and in the darker specimens similar longitudinal streaks in the interspaces) with black scales; costa above vein 8 are chrome yellow. Antennae are black with minute white specks; the long hairs on the head and thorax are greenish grey; the abdomen is black. Beneath, the head, thorax and abdomen are white. The female is similar to the male on the underside, but the scattering of black scales is more prominent; the black on the apex and termen of the forewing and the black spots on the termen of the hindwing are broader and more extended inwards; on the forewing there is an additional spot in interspace 1, and both this and the spot in interspace 3 in many specimens are connected by a line of black scales along the veins to the outer black border; also the spot in interspace 1 often extends across vein 1 into the interspace below. It has a wingspan of 42–60 mm.",https://en.wikipedia.org/wiki/Pieris_canidia
